title,score,id,url,comms_num,created,body,timestamp
Elon Musk Is Not One Of Us. Stop Using Him As a Role Model.,34885,mntcz3,https://www.reddit.com/r/CryptoCurrency/comments/mntcz3/elon_musk_is_not_one_of_us_stop_using_him_as_a/,2865,1618039855.0,"I’m tired of seeing him as a face of crypto in news. He is not one of us. He isn’t your average Joe. He is multi billionaire, one of the richest guys in the world. He doesn’t care about you, about me, about mine or your family. All he cares it’s his ego and his companies.

Lately, we’ve seen a lot of hate towards Mark Zuckerberg from Facebook. Is sweet Elon Musk different? Maybe he isn’t lizardy as Marky is, because he is skrull from Mars. Is Elon any different compared to Mark? Both of them are shilling their own companies, Tesla isn’t different. Just because he offers you to buy Tesla with BTC, it doesn’t mean that he is on your side. He isn’t helping you, he is helping himself. 

While you’re laughing at him shilling DOGE, he is laughing at you how is he manipulating you. He is not helping crypto, he is hurting it. He isn’t same as you or me, he doesn’t have to save money for food, he doesn’t have the count if he has enough for dinner. 

He isn’t on your side, every one of the billionaires are trying to manipulate as much people as they can, to make them believe in theirs own visions and dreams. Just because he pumped your coin, it doesn’t mean that he is your lovely neighbour. 

Elon shouldn’t be used as a model for crypto. Just because he was on Joe Rogan podcast, it isn’t making him a proper role model. 
 
Stop giving him any reputation when it comes to crypto, this guy just shilled a shitcoin and thousands of people falls for it.",2021-04-10 02:30:55
"How much will the price of Litecoin move by Monday, May 10th?",28855,n43gno,https://www.reddit.com/r/CryptoCurrency/comments/n43gno/how_much_will_the_price_of_litecoin_move_by/,387,1620095262.0,"Reference price: $297.69

[Data will be sourced from CoinGecko](https://coingecko.com/en/coins/litecoin)

**FILTERING CRITERIA: 1w, USD, Linear Chart, Close Chart**

Winning results will be based on the price **at 12 pm PDT on May 10th.** Results of the prediction will be revealed **between 11:59 AM PDT and 11:59 PM PDT the day after the prediction date.**

[View Poll](https://www.reddit.com/poll/n43gno)",2021-05-03 21:27:42
"Reminder: Robinhood blocked several stocks from being bought. They locked the buy button when it suited them. Don't buy Bitcoin on Robinhood. The dust has settled, but we remember.",27529,lfrslo,https://www.reddit.com/r/CryptoCurrency/comments/lfrslo/reminder_robinhood_blocked_several_stocks_from/,1252,1612864515.0,"Stop fucking around with these corporate hacks, whether you're in the US, the UK or wherever else Robinhood exists. Tell those leeching fucks on Wall Street to get the fuck out your business, they are obsolete and have no actual use to you now there are plenty of competitors.",2021-02-09 03:55:15
"CryptoNick is deleting all of his BitConnect videos, and so are his buddies. Please never forget what he and his cohorts did to so many people, and how much money those people lost in the process thanks to CryptoNick, Trevon James, and Craig Grant!",26494,7r0ftz,https://www.reddit.com/r/CryptoCurrency/comments/7r0ftz/cryptonick_is_deleting_all_of_his_bitconnect/,3022,1516218368.0,"We can't let these legendary affiliate scammers get away with what they did, and we have to show them all that we are the internet, and that we never forgive, and never forget.

Fuck these guys, and make sure you spread the word around about what they did, and continue to do with other Ponzi's like cloud mining. Go to their videos, and websites, and spread the warning.

These people don't get to just conveniently forget what has happened, and expect the rest of us to just forget about it too! Fuck them, and hopefully some more serious actions get taken against them for what they are responsible for, and please do your research before getting involved with any of these shysters too people. 

You have a responsibility to protect yourself and your friends as well, and you are not exempt of all blame here either for falling for this shit if you did, so wake the fuck up!

***

**Edit**

Since this post blew up, and made its way on over to the /r/All sub-Reddit and most of them don't understand what is going on, I decided to make an edit with a video that pretty much sums up all of the bad actors and more mentioned in this post, so if you want a backstory, just watch this video from /u/dougpolkpoker for a better understanding: https://youtu.be/upPmNzcqFkU",2018-01-17 13:46:08
"""If I had bought BTC in the early 2010's at 10 cents, I would be a millionaire now"". Truth is: You would have sold long before BTC reached even its 2017 ATH of 20k USD.",20915,lijzxr,https://www.reddit.com/r/CryptoCurrency/comments/lijzxr/if_i_had_bought_btc_in_the_early_2010s_at_10/,1512,1613190621.0,"Seeing things in hindsight makes you feel dumb, but the real truth is that back then nobody saw it coming. Only few, very few people really believed in BTC as a store of value or whatever. If you could go back in time and told people in 2010 that in 2021 hedge funds, S&P500 companies and even insurance companies are buying billions worth of BTC at 40k+ USD and using it as a store of value, everybody would just see you as the tin-foil hat person, laugh at you and call you mad and delusional.

This is the reason why I generally feel bad for those ""two pizzas are now worth X millions"" posts, as if the people who traded BTC for goods in the old days could predict the future. As such, the moment your holdings were at 10x your initial investment, very, very likely you would have sold as well, or just bought that awesome thing you could suddenly acquire with magic internet money.

That being said, do not punish yourself with the ""if I had"" thinking. Invest what you can and hold while you can. Taking profits is not a bad idea as well.",2021-02-12 22:30:21
What are some ways to earn some crypto (2$ for example) daily?,20242,mtghzc,https://www.reddit.com/r/CryptoCurrency/comments/mtghzc/what_are_some_ways_to_earn_some_crypto_2_for/,9261,1618793382.0,"I live in a third world country and even 2 dollars a day can definitely change my life in a long run. but i can't do most of the surveys since they usually require KYC. are those games that give you crypto for playing actually work? i even couldn't withdraw my BAT earned with Brave since it also needs KYC.

Edit: Thank you everyone for the suggestions! you all have my upvotes.

Edit2: Man I've been upvoting and answering you guys for the past hour or something i think! thank you all so much you helped me a lot! i wanted to continue but it's 23:15 here i have to sleep and wake up early.

I'll continue upvoting everyone tomorrow! agian, thank you all!",2021-04-18 19:49:42
