title,score,id,url,comms_num,created,body,timestamp
"What happened in the last bear market, as best as I can remember it.",3743,lptrna,https://www.reddit.com/r/CryptoCurrency/comments/lptrna/what_happened_in_the_last_bear_market_as_best_as/,545,1614042526.0,"So the recent price action is probably rekindling the PTSD of us 2017 gang, and I thought it would be fun to take a trip down memory lane and remind us all of the pain and terror of the 2018-2020 bear market, as best as I can recall it.  

#The Elation  
For me, I kept talking to my good friend M about Bitcoin. He told me about it in September and through October to November we watched it sail past $10,000, to $15,000 before we decided to dip our toes. He was dead set on Ripple and bought at about $0.20, and was supposed to come over and show me how to set it up, but on his way over, he was T-boned by a careless driver and we postponed it. In the days after, Ripple shot up and I felt like I missed the boat, and he tipped me off about another good project called ""Cardano""  

*Oh, those merry times*  

I bought some in mid December, and let me tell you that what happened was absolutely insane. For starters, Coinbase was so fucked from the insane level of sign ups, that they couldn't process new accounts. It took **THREE WEEKS** for my account to be verified, and I had to buy Bitcoin from Local Bitcoins, transfer to Binance and then swap to Cardano. What a joke, but hey I got my Cardano. Little did we realise, we were just 1 month from the top. We enjoyed stratospheric gains for one month.  

It felt different than this February, where gains have been ridiculous. Back then, you could've put your money on nearly anything and 8-10x'd in a couple weeks flat. Someone on this reddit described it really well - your money doubled, then doubled again. You'd think ""Surely this is it"", then it doubled again. Finally, it doubled again. And then once more.  

I bought 2 days before the Bitcoin top. I had no idea what happens next.  

For the unaware, alts don't really go up when BTC goes up. Money flows out of alts, into BTC as it gains. When BTC dips, it takes the market with it. But BTC rising up doesn't really take the market up because there are so many who take money out of alts to ride BTC's wave. **The best time to be in alts, is when BTC goes flat**  

And that's kinda what happened. And alts exploded.  

My small Cardano buy doubled, and then doubled, and again and again. Every day I woke up to more green in the portfolio. My mate was making bank off Ripple - it went from 20c to over $3.00. I cursed myself for not just buying Ripple at 44c or whatever it was, and I bought some at $3.15 - basically the top of the market, Ripple's highest ever price.  

I also bought some bags. FunFair went mad, why not, I'll have some. Saw crazy profit on that. ETHLend going mad? Go on then. TRON? Go on then!  

There was no wrong decision in that frenzy.  

Until there was.  

#The Copium  
The gains leveled out. Some days started to get red. Everyone was saying shit like ""Chinese New Year"", ""Wall Street Bonuses"", ""Korea FUD"". Nobody can pin why the bubble popped, but in any assets history, such an incredible period of growth just cannot be sustained. I think it was South Korea basically taking some exchanges offline and it fucked with Coin Stat websites. People panicked and sold. That caused more panic, and more sales.  

The daily gains turned red, very quickly.  

""It's just a dip"" ""Hold!"" ""We need a correction"" was the hopium of the day. Anyone ballsy enough sold, probably everyone who had been in this space since 2016. They'd seen it all before.  

Some coins slowly turned from green, to breakeven, to red.  

And it just kept going down. I remember a brief rally in April. It was a suckers rally, in May my altcoins were mostly back in profit. It went down again. Same thing in August, BTC spiked up, we all thought ""Finally, this is it!"" and then it came back down again. Over and over.

Small blips aside, the Bitcoin bear market lasted from Mid December 2018 to Mid March 2020. That's 15 months, and only then did it start rising properly. We had a false start in early 2019 after the babyish chain split of Bitcoin Cash into BCH and BSV, which plummeted the market into one of the lowest prolonged periods of red I have seen. At this point, many people were down some -80% to -95%, me included.  

#The Effect  
How did it feel? Well to be honest, weird. But it happened over such a long period of time, you just become numb to it. In fact, after periods where your portfolio barely moves 3% in a week, you actually come to enjoy the wild volatility, even when the arse is falling out of it.  

It never stops though, in October 2018, we experienced one of the sharpest in memory, when a childish squabble between Roger Ver and Craig Wright forked the Bitcoin Cash chain into BCH and Bitcoin ""Satoshi's Vision"" (christ)  

This resulted in an absolutely gut-wrenching drop which lasted until early 2019.  

Some days, the losses and gains really did affect my day to day. I've received a couple warnings from work about chart-watching and I've been snappy or elated depending on how much I lost or gained in a day. Now I just truly don't care. I have a target and if I get there, good, if not, I'll wait.

#Is that a light I see?  
2019 started out quite nicely. Price remained stable in the $3,000's until April, where it all started climbing back up again. Alts came along for the ride too. On the summer solstice, BTC broke past $10,000. I smiled as I checked my portfolio, the same day I proposed to my gorgeous fiancee *(that covers my ass in case she reads this)*. Were things looking up?  

Myeh, not quite. This period of >$10,000 lasted until about September and we came back down. Again, a quiet Christmas and then the hope of a new year brought prices up again just nosing past $10,000.  

Up to this point, I had been buying a bunch of stuff. I bought some Golem, it tripled in one of those spikes in 2018 and then I held a worthless token. My ETHLend, Funfair and Tron were basically worthless. The only times I was in profit was when Cardano, Eth or Ripple stirred from their sleep.  

My first Bitcoin buy, to actually buy and keep, was in fuckin November 2019. I set up a monthly buy, but then stopped halfway through 2020 - with Coronavirus, I could've been out of work at a moments notice so all crypto buying stopped.  

In March 2020, we saw Crypto nosedive as Coronavirus struck. This one sucked. In hindsight, these prices were a **fucking steal** - I had the balls to put only one buy in, Cardano at $0.035 and $0.038 - last week, these appreciated 31x and 27x respectively.  

And that was basically the bottom. All has risen from there.  

I made some massive, massive mistakes. I held certain shitcoins way too long, and sold ETHLEND when I broke even on it, because I didn't do any research and didn't get why it was climbing so quickly, which ultimately cost me about $4,500 in wasted gains.

I think the best thing I did was consolidate my entire portfolio. All the shit from Coinbase Earn, I just moved it all into Stellar. All the other crap, I just tied it into the good projects and Bitcoin.  

So does this current dip feel like that bear market? No. It just feels like a correction on the way to something bigger. But I do think we will see, until June, some sideways and mostly negative price action broken up with a few days of gains at a time.  

Some cardinal rules for Crypto:  

* This market is fucking irrational. It doesn't make sense that EOS enjoyed periods of insane growth after the network was basically so congested it was not functional, or after people found out that 98% of the transactions on the network was just blocks filling up with weather data from around the world...  
* Do not ever, **ever** leverage yourself to buy Crypto. I'm talking loans, credit card debt, spending money reserved for rent or mortgage. This market can and will change in the blink of an eye and it's not worth the risk.  
* **Time in the market** is truly better than **timing the market**. I tried trading a handful of times and it was a fantastic way of basically just setting fire to my money. I think my most successful trade I earned about 20 ""free"" ADA. The worst trade I did, I lost about £50 before I figured fuck it.  
* Do some fucking research! I mentioned earlier, I sold ETHLEND before it transformed into AAVE. I sold at $0.12. At it's peak, it was worth about $5.40. It annoys me nearly every fucking day.  
* We are early. Yeah, we really are. Someone on here mentioned that most people can't even tell you what Bitcoin is or does. Get in, stay in. Ride until you can take out your principal and the rest is free money.  
* Don't take it so seriously. This shit definitely affected my day-to-day. You need to learn to let it go and roll with the punches. I put in a marginal amount maybe once a month and it still felt horrible the first few times I saw deep red in the portfolio.  


Have fun guys!",2021-02-22 19:08:46
"2014: “The only use for crypto is to buy drugs” - Now in 2021, my only use for USD is to buy marijuana.",3727,lkvfeo,https://www.reddit.com/r/CryptoCurrency/comments/lkvfeo/2014_the_only_use_for_crypto_is_to_buy_drugs_now/,311,1613477300.0,"I just got approved for the BitPay credit card so now I can use crypto with Apple Pay. Formerly I used Apple Pay for almost every transaction, save for when I (legally) purchased marijuana. Now, marijuana is my only reason to pay in USD. Funny how times change.",2021-02-16 06:08:20
Bitcoin breaches $4000 in 15 minutes. What is happening 😳,3713,a02j45,https://i.redd.it/e90sp9m3mc021.jpg,1562,1543124449.0,,2018-11-24 23:40:49
Who remembers this? lol,3712,j3ypf0,https://i.redd.it/idw7sq0atpq51.png,353,1601687893.0,,2020-10-02 20:18:13
New York Times Front Page Today In Case You Missed It!,3705,8i222k,https://i.redd.it/xi19r6esdqw01.jpg,257,1525857287.0,,2018-05-09 04:14:47
"If you're young and thinking of investing in crypto, please take a second to read this.",3694,7j86nb,https://www.reddit.com/r/CryptoCurrency/comments/7j86nb/if_youre_young_and_thinking_of_investing_in/,941,1513081024.0,"I'm sure this will sound pedantic but with all the excitement lately, I'm seeing a lot of post from people in their 20's and even teens talking about investing large sums in crypto.  Please keep in mind that this is high risk.

That's not to say you shouldn't take some of your hard earned money, do your research and get involved.  This community is amazing, dynamic and there's a ton of potential to make great returns.  However, high risk investment should never be your whole portfolio.  It should be the smallest part.

Make sure that you're setting aside money in a Roth IRA, contributing to your 401k, Vanguard funds, etc.  The boring stuff.  The stuff that grows slowly over a lifetime.  Don't just diversify your coins, diversify your whole portfolio.  It's something I certainly wish I'd tackled at a much younger age.  Believe me, you'll thank me later.  ",2017-12-12 06:17:04
Big event for Crypto. This should spark custodial investor confidence,3665,8p6pvt,https://i.redd.it/bi1df4f7rh211.jpg,360,1528367868.0,,2018-06-07 05:37:48
Tutorial followed by every crypto Youtuber,3653,j96x1t,https://i.redd.it/ylao9nw8dhs51.png,176,1602457363.0,,2020-10-11 18:02:43
Important point to remember,3654,8b09ke,https://i.imgur.com/6NZTEzY.png,290,1523323874.0,,2018-04-09 20:31:14
"A beginner's guide to limit orders, stop orders, and stop limit orders",3645,lolbo6,https://www.reddit.com/r/CryptoCurrency/comments/lolbo6/a_beginners_guide_to_limit_orders_stop_orders_and/,212,1613897986.0,"Someone in the daily said they couldn't wrap their mind around stop limit orders, so I replied to them with what ended up being a rather massive explanation for the 3 types of orders in the post title. I think a lot of beginners (both in the stock market and crypto) struggle with these concepts, so I thought I would post the entire explanation as a guide. So, here it is!

Ok, so there are **limit orders**, **stop orders**, and **stop-limit orders**. The third one combines the concepts of the first two.

Let's start with a sell **limit order.** Perhaps you hold a bunch of some asset currently at $1. You decide that if it hits $1.50, you want to sell. So you make a limit sell order. This is simply an order that will be automatically triggered at the first opportunity to sell at or above the limit price you chose, $1.50. It will only fill if you can get a price equal to or better than the limit price. You're basically publishing an offer to the world, saying ""if ever anyone wants to buy at $1.50 or higher, I am down, and my computer will automatically do the trade with you"".

But imagine you also want to automatically sell if it gets to $0.50 or lower, because you believe that would indicate free fall and you'd want to just cut your losses. A sell limit order wouldn't work here, because a limit order is triggered so long as it can be filled at the limit price or better. So, if you set a sell limit for $0.50 while the price is currently $1.00, it would be instantly triggered and your position would be sold at $1.00, because $1.00 satisfies the condition of being equal to or better than the $0.50 limit price. So, this doesn't do what you want. That's were stop orders (aka stop-losses) come in. A **stop order** will trigger a sell at the best available market price once the stop price has been reached. So, if you set the stop price to $0.50, then once the market price passes below that threshold, your position will be sold at the best available market price in that moment (which will usually be very very close to the stop price you set).

So, here is the difference between a limit order and a stop order: in a limit order, the limit price is just a threshold above which you will accept a trade and below which you will not. It's basically like an open offer to sell at some price. With a stop order, the stop price is not a threshold below which you will accept a trade. Instead, it is a trigger: once the market price passes your stop price, then your position will be sold instantly to the highest bidder in that moment.

Now, this means that usually your position will be sold basically right at the stop price (or very close, like $0.4998), because if your position is being sold to the highest bidder the moment the price touches your stop price, the highest bidder will basically be buying at the stop price. However, there are exceptions.

For example, in the stock market, there is after-hours trading when you can't trade, but special people can. Now, imagine the day closes with the price at $0.55, and your stop price is $0.50. During after hours, a bunch of whales dump the stock, and by open tomorrow morning, it is at $0.20. Your stop loss will be instantly triggered and you will sell at $0.20, not $0.50 like you wanted. This is because the triggering event of the market price passing your stop price happened (during after hours), so the position was sold at the earliest possible time at the highest available price, which happened to be at market open the next day at $0.20.

Another example is this: imagine a gigantic whale decides to sell an absurd amount of your crypto just a tiny bit above your stop loss price, at like $0.501. This triggers a massive selloff and the price drops off a cliff. It therefore drops past your stop price, so automatically you get in line to sell at the highest available price. But the demand to buy at $0.50 has already come and gone, and there aren't enough buyers to keep up with the sellers, so by the time your transaction actually gets filled, it ends up being at $0.45, not $0.50. This is called price slippage, by the way.

A third example: imagine your exchange goes down for 10 minutes when the price is at $0.52, but once it comes back 10 minutes later, the price is at $0.25, since other exchanges were running during those 10 minutes. Now your stop order will be filled at $0.25. Not ideal.

This finally brings us to the **stop limit.** The stop limit combines both limit orders and stop losses. They require that you specify two prices: the stop price, and the limit price. If the market price passes the stop price, that triggers the creation of a limit order with the limit price you specified. Let's consider a couple cases where you might want to use this.

Let's say, like before, you believe if the price gets as low as $0.50, then that signals that you need to exit. However, you are definitely not willing to sell below $0.30. You would rather just hold and hope it recovers one day than sell that low. So, you make a stop limit order where the stop price is $0.50 and the limit price is $0.30. The moment the price gets as low as $0.50, the stop will be triggered, which will then create a limit order whose limit price is $0.30. So, the stop price is the trigger to decide you want to make a sell offer, and the limit price is the lowest you are willing to sell for once the stop trigger actually happens. 99% of the time, this stop limit order will mean you end up selling basically right at $0.50, just like the stop order we talked about earlier. Once the stop price is passed, your limit order will be created for $0.30, which will immediately be filled at like $0.499, because that is the current price, and it satisfies the condition of the limit order, which is to sell at or above the limit price of $0.30. However, in the off-chance that your stop price is triggered at $0.50, but the price then somehow teleports down to $0.25 (after hours trading, price slippage, or your exchange going down) then your position would not be sold, because the price is below the limit price you set. If the price eventually recovered to $0.30, your position would then be sold at that price, if you hadn't cancelled it by then.

Another use case would be this. Say, once again, you believe that if the price drops below $0.50, that is a red flag that you should exit your position. However, you believe that if it does get that low, there is a very good chance that there will be a dead cat bounce (where something makes a short-lived partial recovery while it is in its death throes). You bet that, if this coin gets as low as $0.50, it will briefly make it back up to $0.70 before crashing fully and dying. So, you make a stop limit order with $0.50 stop price, and a $0.70 limit price. If ever the price gets as low as $0.50, you will now automatically publish an offer to sell at $0.70 (ie: a limit order with $0.70 limit price will be created). If the price now rebounds up to $0.70 like you thought it would, your order will be filled and you will sell at $0.70. If it doesn't end up rebounding that high, your order won't be filled, and you'll end up holding. It's like saying ""I believe if we go as low as $0.50, that's a good indication we are crashing hard, so I will try to exit at $0.70 shortly thereafter during a bounce, but if I can't get that good of a deal, I guess I'll just hold and hold and hope it recovers one day"".

So, in summary: A **limit order** is an open offer to sell at a certain price or better that you publish to the market. A **stop order** is a trigger threshold, which, if passed, means your position will be sold ASAP at current market price. A **stop limit order** is a trigger threshold, which, if passed, creates a limit order.

Finally, I want to note that all these examples have to do with selling, but these types of orders exist for buying as well. It works the same way, but everything is flipped. For example, if you want to buy a coin, but only if it dips below $0.25 so that it's affordable to you, then you would make a limit buy order with $0.25 as the limit price, and you would automatically buy that position if ever someone is willing to sell at that price (ie: the market price dips that low). 

I hope this helps somebody!",2021-02-21 02:59:46
Elon Musk says Mars economy will run on cryptocurrency,3631,klpqi6,https://www.independent.co.uk/life-style/gadgets-and-tech/elon-musk-mars-cryptocurrency-marscoin-b1779456.html,668,1609187577.0,,2020-12-28 14:32:57
"Kraken telling customers on the login page: ""Not your keys, not your coins"". This is the type of business I can support",3636,mwyupw,https://www.reddit.com/r/CryptoCurrency/comments/mwyupw/kraken_telling_customers_on_the_login_page_not/,829,1619223324.0,"One of their tips: ""Keep the majority of your crypto offline in a hardware wallet. Only keep the funds you need for trading and other activities on Kraken.""

The fact that they want people to get crypto off their platform is an indicator that they are customer-centric. They'd benefit if people kept it there because they could use customer's crypto to stake it themselves and make a wagonload of money.

It's good for the crypto space that we have exchanges that are doing their best for customers. We win, they win. I doubt Kraken is perfect, because who is? They are trying, and that's what matters to me.

I'm not sponsored by them, check my comment history, I'm just a random customer. I am currently using Binance US, Coinbase Pro, Voyager as well, so if you have questions about them, I'll answer what I know. 

Side note if Kraken is reading this: Please allow us to do ACH deposit! :)",2021-04-23 19:15:24
"""Sell me this Shitcoin"" - (volume on!)",3623,9rt695,https://v.redd.it/b42wvfjt2pu11,310,1540663221.0,,2018-10-27 13:00:21
My (crypto)life ambition,3621,jie0x4,https://i.redd.it/4pa87q3jsfv51.jpg,214,1603745810.0,,2020-10-26 15:56:50
I am starting a blog aimed at making Korean cryptocurrency news available to people here,3605,7rqgsm,https://www.reddit.com/r/CryptoCurrency/comments/7rqgsm/i_am_starting_a_blog_aimed_at_making_korean/,227,1516484947.0,"I speak and understand Korean, and have noticed there is a huge gap between the Korean markets and the Western ones, mostly due to misunderstandings. I am starting a blog which will aim to proof or disproof rumors concerning the Korean market or generally post overviews concerning the state of cryptocurrency in Korea. I will post sources here as well, it will be factual and translated by hand.

https://cryptoglobal.wordpress.com/
Twitter: https://twitter.com/Korean_Crypto

I am not sure how much interest my blog will garner, therefore I am posting the link here and asking anyone who interested in this project to follow me so I can gradually start up this project. Hope it is welcomed!

EDIT: Thanks for all the enthousiasm. I have received so many direct messages, tips and so forth. I will reply to all in due time. In the mean time I have created an ETH donation wallet per a Redditor's suggestion: 0xE3bda59819Dc73A5F78B12Fe493D7D6C139D823D",2018-01-20 15:49:07
Sounds familiar,3571,c1mppa,https://i.redd.it/cc2vyjl4qw431.png,177,1560801870.0,,2019-06-17 15:04:30
Ehh,3581,fozb5r,https://i.redd.it/fjcq65tm6wo41.jpg,210,1585202797.0,,2020-03-26 01:06:37
"Paying for lunch in Venezuela where $1 USD equals $107,000 Bolivar, thanks to the government and hyperinflation. This is why crypto will win.",3550,7mp7el,https://i.redd.it/wce5nmd74q601.jpg,582,1514521957.0,,2017-12-28 22:32:37
Official: The European Commission will invest $370 million in projects supporting the use of blockchain and will actively support blockchain ecosystems,3548,8b8zjb,http://europa.eu/rapid/press-release_IP-18-2902_en.htm,194,1523406681.0,,2018-04-10 19:31:21
BrainBlocks - PayPal Checkout lead engineer begins work on Raiblocks (XRB) checkout app,3539,7pvah1,https://medium.com/@bluepnume/introducing-brainblocks-my-weekend-hack-project-to-build-a-simple-checkout-app-for-raiblocks-5f5770c06c14,437,1515774578.0,,2018-01-12 10:29:38
My dad believed in Bitcoin more than I did.,3533,kpv4r6,https://www.reddit.com/r/CryptoCurrency/comments/kpv4r6/my_dad_believed_in_bitcoin_more_than_i_did/,200,1609743258.0,"He passed in March of last year. We had talked about Bitcoin and some other cryptos quite a bit in the few years prior to that.

Knowing his time was near, one of the last things that he said to me was that he felt strongly that he believed Bitcoin would be the key to financial freedom for me.

It is looking more and more like he was right.

I just wish he was still around to see it.

I love and miss you, dad.

EDIT:  Really wasn't expecting this to blow up so much.  Thank you so much for all of the kind words.",2021-01-04 00:54:18
Unpopular opinion: These price prediction polls are just as bad as Meme Weekends,3528,mzl7p7,https://www.reddit.com/r/CryptoCurrency/comments/mzl7p7/unpopular_opinion_these_price_prediction_polls/,431,1619547276.0,"Idk if its just me - but does anyone else feel the same?

These polls add nothing of value to the discussion but are still taking up the entire front page in place of quality content - I'm getting serious flashbacks to when Moon farmers kept spamming memes the sub every weekend with the same recycled memes.

Maybe these things could belong to a different sub and just be linked through a single post instead?",2021-04-27 13:14:36
Visa CEO: We’ll let you spend crypto at 70 million merchants,3531,m7acnr,https://coinmarketcap.com/tr/headlines/news/visa-ceo-well-let-you-spend-crypto-at-70-million-merchants/,472,1616043128.0,,2021-03-17 23:52:08
Let us not forget the guy who sparked the great bullrun of 2017!,3502,a17uir,https://i.redd.it/56djhynyn3121.png,160,1543452033.0,,2018-11-28 18:40:33
"JPMorgan sued over fraudulent ""surprise fees"" charged to customers buying crypto currency.",3499,8bjpe0,https://www.reuters.com/article/us-jpmorgan-crypto-currencies/jpmorgan-sued-over-fees-for-cryptocurrency-purchases-idUSKBN1HI2T4,232,1523502591.0,,2018-04-11 22:09:51
